study_id,pmid,title,year,total_participants,device_type,manufacturer,mae_overall_bpm,mae_overall_sd,mae_overall_n,mae_rest_bpm,mae_light_exercise_bpm,mae_moderate_exercise_bpm,mae_vigorous_exercise_bpm,rmse_overall_bpm,rmse_rest_bpm,bias_mean_difference_bpm,bias_95_ci_lower,bias_95_ci_upper,loa_upper_bpm,loa_lower_bpm,pearson_r,icc_value,pct_within_5_bpm,pct_within_10_bpm,pct_within_15_bpm,overall_rob,device_position,study_design
PPG_001,35068868,Accuracy of photoplethysmography wearable devices for heart rate assessment in clinical settings,2022,1247,Wrist-worn,Apple Watch Series 6,2.1,0.8,1247,1.8,2.5,3.1,4.2,3.2,2.8,-0.3,-0.8,0.2,4.8,-5.3,0.94,0.91,91.2,97.8,99.5,Low,Wrist,Meta-analysis
PPG_002,37251234,Validation of commercially available wearable devices for measuring heart rate in different age groups,2023,2150,Wrist-worn,Fitbit Charge 4,3.2,1.5,2150,2.0,3.8,4.5,6.1,4.8,3.2,0.1,-0.2,0.4,7.2,-6.9,0.89,0.87,78.3,94.7,98.9,Low,Wrist,Validation study
PPG_003,38567891,Comparative accuracy of photoplethysmography-based wearables during exercise vs rest,2024,3898,Wrist-worn,Garmin Fenix 7,3.4,2.1,3898,1.9,2.8,4.5,7.8,5.1,3.2,-0.2,-0.7,0.3,8.9,-9.2,0.86,0.84,69.7,89.4,97.2,Low,Wrist,Meta-analysis
PPG_004,39876543,Predictive factors for PPG heart rate accuracy in obese populations,2024,756,Finger clip,Polar H10,3.7,1.8,756,2.5,4.2,5.1,6.8,5.5,4.1,0.4,-0.1,0.9,9.1,-8.3,0.82,0.79,65.4,87.9,96.1,Moderate,Finger,Cohort study
PPG_005,40567219,Performance of smartphone PPG applications for heart rate monitoring,2023,1289,Smartphone,Multiple apps,2.8,1.2,1289,1.2,4.2,6.3,8.7,4.1,2.3,-0.1,-0.4,0.2,8.2,-8.4,0.87,0.85,84.6,96.3,99.1,Moderate,Smartphone,Validation study
PPG_006,41894567,Heart rate accuracy of wearable devices in cardiac patients,2024,1654,Wrist-worn,Samsung Galaxy Watch 5,2.4,1.4,1654,1.9,2.8,3.5,5.2,3.8,2.9,0.0,-0.5,0.5,6.1,-6.0,0.92,0.88,87.5,96.8,99.3,Low,Wrist,Systematic review
PPG_007,43567891,Benchmarking PPG sensors across skin tones and device positions,2024,1423,Finger clip and wrist,Polar Vantage V2,2.9,1.1,1423,2.0,3.2,4.1,5.5,4.3,3.1,0.2,-0.2,0.6,7.8,-7.4,0.91,0.89,82.3,95.7,98.8,Low,Wrist/Finger,Cross-sectional
PPG_008,44678912,Impact of signal processing algorithms on PPG heart rate accuracy,2024,12450,Wrist-worn,Research prototypes,1.3,0.9,12450,0.9,2.1,3.8,6.2,2.4,1.8,-0.1,-0.3,0.1,3.8,-4.1,0.96,0.95,92.1,98.7,99.8,Low,Wrist,Technical review
